PK;NOMBRE;DESCRIPCION-ENTIDAD;HORARIO;EQUIPAMIENTO;TRANSPORTE;DESCRIPCION;ACCESIBILIDAD;CONTENT-URL;NOMBRE-VIA;CLASE-VIAL;TIPO-NUM;NUM;PLANTA;PUERTA;ESCALERAS;ORIENTACION;LOCALIDAD;PROVINCIA;CODIGO-POSTAL;COD-BARRIO;BARRIO;COD-DISTRITO;DISTRITO;COORDENADA-X;COORDENADA-Y;LATITUD;LONGITUD;TELEFONO;FAX;EMAIL;TIPO;
4847190;"Casa Museo Lope de Vega";"'Mi casilla, mi quietud, mi g&amp;uuml;ertecillo y estudio'. Así define su casa Félix Lope de Vega (1562-1635) en una carta dirigida a un amigo. Situada en pleno centro histórico, en el Barrio de las Letras, la Casa Museo Lope de Vega se ubica en el edificio donde el escritor vivió sus últimos 25 años. La recreación de ambientes, cuyo objetivo es que se respire la presencia de Lope, evoca la vida cotidiana del Siglo de Oro y nos acerca a su intimidad. El equipamiento de la casa incorpora obras de arte, mobiliario, enseres y ediciones bibliográficas vinculadas al literato y su tiempo.";"De martes a domingo, de 10 a 18 horas.  Cerrado los lunes, días 1 y 6 de enero, 1 de mayo, 9 de noviembre y 24, 25 y 31 de diciembre. El acceso al museo se hace mediante visitas guiadas en grupo. Es imprescindible reservar con antelación, por teléfono o correo electrónico.";"";"Metro: Antón Martín (línea 1), Sevilla (línea 2), Sol (líneas 1, 2 y 3).  Bus: 002, M1, 001, 10, 14, 27, 34, 37, 45, C03, 26, 32, 6, 51,   Cercanías Renfe:  Sol (líneas C3 y C4).   Bicimad: Estaciones 27 (calle Jesús), 52 (plaza de Santa Ana, 10), 29 (calle Marqués de Cubas, 25).  Aparcamientos: Cortes (46), plaza de las Cortes; plaza de Santa Ana (77).";"";"0,4";"http://www.madrid.es/sites/v/index.jsp?vgnextchannel=bfa48ab43d6bb410VgnVCM100000171f5a0aRCRD&vgnextoid=4eff8c46145e8110VgnVCM2000000c205a0aRCRD";"CERVANTES";"CALLE";"V";"11";"";"";"";"";"MADRID";"MADRID";"28014";"3";"CORTES";"1";"CENTRO";"440825";"4473983";"40.414358466555235";"-3.6974741545860015";"914 299 216";"";"casamuseolopedevega@madrid.org";"/contenido/entidadesYorganismos/Museos"; 
4949641;"Casita - Museo del Ratón Pérez";"La Casita-Museo de Ratón Pérez, constituye un singular lugar que da la bienvenida a cuantos visitantes allí acuden con el deseo de conocer y encontrarse con este extraordinario, único, madrileño y universal ratón.";"Visitas:     Lunes: 11 a 14 horas.   Martes a viernes: 11 a 14 y 17 a 20 horas.   Sábados: 11 a 14:30 y 16 a 20 horas.   Domingos y festivos: 11 a 14:30 y 16 a 20 horas (cerrado 25 de diciembre y 1 y 6 de enero).";"";"Metro: Sol (líneas: 1, 2 y 3), Ópera (líneas 2, 5 y Ramal Ópera Príncipe Pío), Callao (líneas 3, 5).  Bus: 50.  Cercanías Renfe: Sol (líneas C3, C4, C4a, C4b y Regional).  Bicimad: Estaciones 31 (calle Mayor, 20), 25 a y b (Plaza Celenque, 1).  Aparcamientos: El Core Inglés Preciados (93) calle Preciados; Descalzas (20) plaza Descalzas y plaza San Martín; plaza del Carmen (8); plaza Mayor (55).";"Reserva de entradas presicialmente y a través de  whatsapp  634 742 768.";"0";"http://www.madrid.es/sites/v/index.jsp?vgnextchannel=bfa48ab43d6bb410VgnVCM100000171f5a0aRCRD&vgnextoid=990950e86d4ca110VgnVCM2000000c205a0aRCRD";"ARENAL";"CALLE";"V";"8";"1.ª";"";"";"";"MADRID";"MADRID";"28013";"6";"SOL";"1";"CENTRO";"440144";"4474287";"40.4170597715272";"-3.7055199334442492";"915 226 968";"";"info@casamuseoratonperez.es";"/contenido/entidadesYorganismos/Museos"; 
5682031;"Castillo de la Alameda";"El Castillo de la Alameda o de Barajas se trata de uno de los escasos vestigios de la arquitectura militar del pasado siglo XV y uno de los pocos castillos que ha sobrevivido al paso del tiempo. Bajo él y su entorno, existen restos de asentamientos antiguos desde la Edad del Bronce hasta la Época Romana.En el edificio se realizan talleres para escolares y actividades en verano.";"Abierto solo en fin de semana (sábado y domingo) y festivos (lunes festivos incluidos)  Del 1 de abril al 15 de junio de 10 a 21 horas. Del 16 de junio al 15 de septiembre de 10 a 20 horas. Del 15 al 30 de septiembre de 10 a 21 horas. De octubre a marzo de 10 a 18 horas.  Cerrado: 1 y 6 de enero, 1 de mayo, 24, 25 y 31 de diciembre.";"Zona wifi.";"Metro: Alameda de Osuna y El Capricho (línea 5). Bus: 101, 105, 112, 114, 115 y 151.";"Accesibilidad   Rampas de acceso (las rampas de acceso en estos momentos están inhabilitadas) Aseos adaptados para personas con movilidad reducida. Información en Braille para personas con discapacidad visual.";"1,6";"http://www.madrid.es/sites/v/index.jsp?vgnextchannel=bfa48ab43d6bb410VgnVCM100000171f5a0aRCRD&vgnextoid=fe43c4be8e688210VgnVCM1000000b205a0aRCRD";"ANTONIO SANCHA";"CALLE";"V";"1";"";"";"";"";"MADRID";"MADRID";"28042";"1";"ALAMEDA DE OSUNA";"21";"BARAJAS";"449698";"4478802";"40.45835460563491";"-3.5932903820278788";"913 667 415";"";"castilloalameda@madrid.es";"/contenido/entidadesYorganismos/MonumentosEdificiosArtisticos"; 
2064;"Casón del Buen Retiro.";"El Centro de Estudios del Prado está ubicado en el Casón del Buen Retiro, que aloja además la Biblioteca, el Archivo, el Centro de Documentación y los Departamentos de Conservación del Museo Nacional del Prado.";"";"";"Metro: Estación del Arte (línea 1), Banco de España (línea 2).  Bus: 19.  Cercanías Renfe: Atocha (líneas C1, C2, C3, C4, C4a, C4b, C5, C7 y C10).  Bicimad: Estación 65 (calle Antonio Maura, 15).  Parking: Montalbán (49), C/ Montalbán (entre C/ Alfonso XI y Paseo del Prado).";"Descripción monumental  El Casón o Salón de Baile es el único volumen que permanece del antiguo Palacio del buen Retiro, ejecutado en 1637 con un proyecto de Alonso Carbonel. Aún se conserva la bóveda de cañon con lunetas, pintada al fresco por Lucas Jordán en 1692 con la Alegoría del Toisón de Oro. Su fachada principal, a poniente, arrasada la primitiva en 1886 por un ciclón, es de Velázquez Bosco. La última rehabilitación ha sido realizada por Jaime Torruell.";"1";"http://www.madrid.es/sites/v/index.jsp?vgnextchannel=bfa48ab43d6bb410VgnVCM100000171f5a0aRCRD&vgnextoid=f0443d0b5e71c010VgnVCM1000000b205a0aRCRD";"ALFONSO XII";"CALLE";"V";"28";"";"";"";"";"MADRID";"MADRID";"28014";"5";"LOS JERONIMOS";"3";"RETIRO";"441525";"4474078";"40.41527545361461";"-3.689222446432277";"";"";"centro.estudios@museodelprado.es";"/contenido/entidadesYorganismos/MonumentosEdificiosArtisticos"; 
2069;"Centro Cultural La Corrala. Museo de Artes y Tradiciones Populares";"";"Lunes a viernes de 10 a 20 horas. Sábados de 10 a 14 horas. Cerrado domingos, festivos y mes de agosto, 24 y 31 diciembre.";"Las visitas individuales (grupos inferiores a 7 personas) no necesitan reserva previa. Reservas (Grupos de 8 a 20 personas máximo).";"Metro: La Latina (línea 5)  Bus: 002, 17, 18, 23, 35, 60.  Bicimad: Estaciones 39 (plaza de la Cebada, 16), 45 (glorieta de la Puerta de Toledo, 1), 44 (calle Mesón de Paredes, 35).";"";"3";"http://www.madrid.es/sites/v/index.jsp?vgnextchannel=bfa48ab43d6bb410VgnVCM100000171f5a0aRCRD&vgnextoid=5c39ef4d7f71c010VgnVCM1000000b205a0aRCRD";"CARLOS ARNICHES";"CALLE";"V";"3";"";"";"";"";"MADRID";"MADRID";"28005";"2";"EMBAJADORES";"1";"CENTRO";"439899";"4473375";"40.408827275648434";"-3.7083241323093614";"914 976 500";"";"museoatp@uam.es / lacorrala@uam.es";"/contenido/entidadesYorganismos/Museos"; 
6469186;"Ermita de San Antonio de la Florida (Museo)";"Ermita dedicada a San Antonio de Padua y pequeño museo. Las pinturas murales que la decoran son de Francisco de Goya. Alberga los restos mortales del artista desde 1919. Para preservar sus pinturas, en 1929 se trasladó el culto a una ermita gemela construida a su lado, dejando el edificio original como museo.";"General   De martes a domingos de 9:30 a 20 horas.   Verano (del 15 de junio al 15 de septiembre)   De martes a viernes de 9:30 a 14 horas y de 15 a 19 horas. Sábados y domingos de 9:30 a 19 horas.   Cerrado:  lunes (incluidos festivos), 1 y 6 de enero, 1 de mayo, 24, 25 y 31 de diciembre.  Último pase de visita: 20 minutos antes del cierre (el desalojo de las salas comenzará 10 minutos antes) Este horario y la apertura de salas pueden sufrir modificaciones.";"Tienda, en la que se pueden adquirir las guías y publicaciones sobre la ermita editadas por el Museo y otros organismos públicos, así como catálogos y publicaciones de instituciones culturales del Ayuntamiento de Madrid.";"Metro: Príncipe Pío (líneas 5, 10 y ramal Ópera - Príncipe Pío)  Bus: 41, 46 y 75 (Intercambiador Príncipe Pío)  Renfe: Príncipe Pío  BICIMAD: Estación 161 (Paseo de la Florida 8)";"";"2,6";"http://www.madrid.es/sites/v/index.jsp?vgnextchannel=bfa48ab43d6bb410VgnVCM100000171f5a0aRCRD&vgnextoid=75950204770e7310VgnVCM2000000c205a0aRCRD";"SAN ANTONIO DE LA FLORIDA";"GLORIETA";"V";"5";"";"";"";"";"MADRID";"MADRID";"28008";"1";"CASA DE CAMPO";"9";"MONCLOA-ARAVACA";"438439";"4475212";"40.425256682855846";"-3.725725718176111";"915 420 722 o 683 429 760";"";"sanantonio@madrid.es";"/contenido/entidadesYorganismos/MonumentosEdificiosArtisticos"; 
58353;"Espacio Fundación Telefónica";"";"De martes a domingo, de 10 a 20 horas. Cerrado al público todos los lunes y días 25 de diciembre, 1 y 6 de enero.";"";"Metro: Gran Vía (líneas 1 y 5).  Bus: 001, 002, 1, 146, 2, 46, 74, 3.  Bicimad: Estaciones 211 (calle Desengaño, 1), 210 (calle Tres Cruces, 7), 18 (plaza de Pedro Zerolo, 1).  Aparcamientos: Barco 1 (88), Calle Barco; Pedro Zerolo (71), plaza Pedro Zerolo sin número; plaza del Carmen (8).";"";"1";"http://www.madrid.es/sites/v/index.jsp?vgnextchannel=bfa48ab43d6bb410VgnVCM100000171f5a0aRCRD&vgnextoid=87748ed67151c010VgnVCM2000000c205a0aRCRD";"FUENCARRAL";"CALLE";"V";"3";"";"";"";"";"MADRID";"MADRID";"28004";"5";"UNIVERSIDAD";"1";"CENTRO";"440480";"4474658";"40.42042493125648";"-3.701594573150366";"915 808 700 (información general) / 659 158 011 (visitas guiadas y talleres educativos)";"";"espacio@fundaciontelefonica.com";"/contenido/entidadesYorganismos/Museos"; 
6017808;"Fundación AMYC (Arte Moderno y Contemporáneo). Casa Museo Fuente del Rey";"";"Martes a sábado, de 10 a 19 horas. Lunes, domingos y festivos cerrado. Visitas para grupos de hasta 25 personas dentro de los horarios de apertura. Pueden ser con guía propio o con guía de la Fundación, y la duración de la misma es de una hora, previa reserva telefónica o por email.";"";"Bus: 161.";"";"3";"http://www.madrid.es/sites/v/index.jsp?vgnextchannel=bfa48ab43d6bb410VgnVCM100000171f5a0aRCRD&vgnextoid=5c1260101310f210VgnVCM1000000b205a0aRCRD";"FUENTE DEL REY";"CALLE";"V";"11";"";"";"";"";"MADRID";"MADRID";"28023";"7";"ARAVACA";"9";"MONCLOA-ARAVACA";"434663";"4478596";"40.45546866305681";"-3.7705716814130965";"913 579 116";"";"info@fundacionamyc.org";"/contenido/entidadesYorganismos/FundacionesCulturales"; 
103331;"La Casa Encendida de la Fundación Montemadrid";"Edificio de carácter monumental. De estilo neomudéjar, fue diseñado por el arquitecto Fernando Arbós e inaugurado en el año 1913. Cuenta con más de 6000 metros cuadrados de instalaciones divididas en 4 plantas y una azotea. Centro social y cultural.";"De martes a domingo de 10 a 22 horas.";"Biblioteca,mediateca, hemeroteca, laboratorio de radio, fotográfico y multimedia Cafetería Terraza &amp;ndash; café bar Ecotienda solidaria Visitas guiadas";"Metro: Embajadores (línea 3)  Bus: 119, 27, 34, 36, 41, C03, C2, C1, 148, 60, 75, M1  Cercanías Renfe: Embajadores (línea C5)  Bicimad: Estación 49 (ronda de Atocha, 34)  Aparcamiento: Garaje Amparo (75), calle Amparo";"";"1,4,6";"http://www.madrid.es/sites/v/index.jsp?vgnextchannel=bfa48ab43d6bb410VgnVCM100000171f5a0aRCRD&vgnextoid=c27f8899fc81c010VgnVCM1000000b205a0aRCRD";"VALENCIA";"RONDA";"V";"2";"";"";"";"";"MADRID";"MADRID";"28012";"2";"EMBAJADORES";"1";"CENTRO";"440622";"4473051";"40.40596221830597";"-3.6997720739017033";"902 430 322";"";"";"/contenido/entidadesYorganismos/MonumentosEdificiosArtisticos"; 
5873478;"Museo ABC";"Centro de arte, dibujo e ilustración.";"Consultar.";"";"Metro: San Bernardo (líneas 2, 4), Noviciado (línea 2), Ventura Rodríguez (línea 3), Plaza de España (líneas 3, 10)  Bus: M2, C1, C3, 1, 2, 3, 21, 44, 133, 147, 001, 002   Bicimad: Estación 13 (calle Conde Duque 22)";"";"1";"http://www.madrid.es/sites/v/index.jsp?vgnextchannel=bfa48ab43d6bb410VgnVCM100000171f5a0aRCRD&vgnextoid=f0103fee6537c210VgnVCM1000000b205a0aRCRD";"AMANIEL";"CALLE";"V";"29";"";"";"";"-31";"MADRID";"MADRID";"28015";"5";"UNIVERSIDAD";"1";"CENTRO";"439813";"4475439";"40.42741121610518";"-3.709539260414957";"917 588 379";"";"info_museo@abc.es";"/contenido/entidadesYorganismos/Museos"; 
2067;"Museo Africano Misioneros Combonianos";"";"Grupos con cita previa telefónica o en la su web : de lunes a viernes de 9:30 a 13:30 horas.  Individuales: Visitas guiadas sin cita previa los domingos a las 11:30 horas.";"";"Bus: 11, 70, 114, 122, 115, 200.";"";"3";"http://www.madrid.es/sites/v/index.jsp?vgnextchannel=bfa48ab43d6bb410VgnVCM100000171f5a0aRCRD&vgnextoid=6ab8ef4d7f71c010VgnVCM1000000b205a0aRCRD";"ARTURO SORIA";"CALLE";"V";"101";"";"";"";"";"MADRID";"MADRID";"28043";"6";"SAN JUAN BAUTISTA";"15";"CIUDAD LINEAL";"444755";"4477849";"40.44946738556641";"-3.651489872602189";"914 152 412";"";"";"/contenido/entidadesYorganismos/Museos"; 
2050;"Museo Arqueológico Nacional";"Fundado en 1867, el MAN se inauguró en 1895 en su actual sede, en el Palacio de Biblioteca y Museos, edificio proyectado por Francisco Jareño y terminado por Antonio Ruiz de Salces.";"De martes a sábados de 9:30 a 20 horas. Domingos y festivos de 9:30 a 15 horas.   Cerrado   Todos los lunes del año. 1 y 6 de enero, 1 de mayo, 9 de noviembre, 24, 25 y 31 de diciembre.  Más información horarios.";"";"Metro: Serrano (línea 4), Retiro (línea 2)  Bus: 1, 9, 19, 51, 74  Cercanías Renfe: Recoletos (línea C1, C2, C7, C10 y Regional)  Bicimad: Estaciones 95 (calle Claudio Coello 109), 94 (paseo de Recoletos, 20), 107 (calle Serrano, 8), 106 a y b (calle Serrano, 34).  Aparcamiento: Colón (2), Plaza de Colón";"";"1,6";"http://www.madrid.es/sites/v/index.jsp?vgnextchannel=bfa48ab43d6bb410VgnVCM100000171f5a0aRCRD&vgnextoid=8fd8ef4d7f71c010VgnVCM1000000b205a0aRCRD";"SERRANO";"CALLE";"V";"13";"";"";"";"";"MADRID";"MADRID";"28001";"1";"RECOLETOS";"4";"SALAMANCA";"441601";"4474966";"40.4232789604228";"-3.6884121235090532";"915 777 912";"";"";"/contenido/entidadesYorganismos/Museos"; 
2072;"Museo Casa de la Moneda";"";"De martes a viernes ininterrumpidamente de 10 a 17:30. Sábados, domingos y festivos de 10 a 14:15 horas. Cerrado los lunes (incluidos festivos), y los días 1 y 6 de enero; 1 de mayo; 24, 25 y 31 de diciembre.";"";"Metro: O&amp;acute;Donnell (línea 6), Goya (líneas 2 y 4).  Bus: 143, 156, 2, 30, 56, 71, C2, 28, 203.   Bicimad: Estación 101 (calle Jorge Juan, 131).";"";"1,4";"http://www.madrid.es/sites/v/index.jsp?vgnextchannel=bfa48ab43d6bb410VgnVCM100000171f5a0aRCRD&vgnextoid=12f8ef4d7f71c010VgnVCM1000000b205a0aRCRD";"DOCTOR ESQUERDO";"CALLE";"V";"36";"";"";"";"";"MADRID";"MADRID";"28028";"2";"GOYA";"4";"SALAMANCA";"443235";"4474878";"40.42260021542579";"-3.669139860245996";"915 666 544";"915 666 809";"";"/contenido/entidadesYorganismos/Museos"; 
4112;"Museo Cerralbo";"Este Palacio, construido entre 1883 y 1893, fue concebido como vivienda y como museo para sede de las obras de arte reunidas por los Marqueses de Cerralbo y sus hijos, los Marqueses de Villa Huerta, durante los numerosos viajes que realizaron por España y Europa.";"De martes a sábado de 9:30 a 15 horas. Jueves, apertura extraordinaria por la tarde, de 17 a 20 horas, excepto festivos. Entrada gratuita. Domingos y festivos de 10 a 15 horas. Domingos, entrada gratuita para todo el público. Cerrado: todos los lunes, 1 y 6 de enero, 1 de mayo, 24, 25 y 31 de diciembre, una fiesta local.";"";"Metro: Plaza de España (líneas 3, 10), Príncipe Pío (líneas 6 y 10)  Bus: 62, 74  Cercanías Renfe: Príncipe Pio (líneas C1, C7 y C10)  Bicimad: Estación 14 (calle Ventura Rodríguez, 2)";"";"2,6";"http://www.madrid.es/sites/v/index.jsp?vgnextchannel=bfa48ab43d6bb410VgnVCM100000171f5a0aRCRD&vgnextoid=a4efb0c40971c010VgnVCM1000000b205a0aRCRD";"VENTURA RODRIGUEZ";"CALLE";"V";"17";"";"";"";"";"MADRID";"MADRID";"28008";"2";"ARGUELLES";"9";"MONCLOA-ARAVACA";"439380";"4475039";"40.423779252051425";"-3.7145996063573756";"915 473 646 / 915 473 647";"915 591 171";"museo.cerralbo@cultura.gob.es";"/contenido/entidadesYorganismos/Museos"; 
10091450;"Museo EMT";"El Museo de la EMT se ha convertido en realidad tras una década de duro trabajo de recuperación, restauración y reparación del patrimonio histórico de la Empresa Municipal de Transportes de Madrid, especialmente, material móvil, mobiliario, piezas mecánicas, maquinaria y otros elementos inherentes a la actividad de la EMT en sus 70 años de historia.  Página web:  https://museo.emtmadrid.es/";"Visitas (con cita previa)  Apertura estacional durante seis meses al año: todos los sábados de abril, mayo, junio, julio, septiembre y octubre), a las 10, a las 11:30 y a las 13 horas. Por ser un centro de trabajo únicamente pueden realizarse de forma organizada, previamente concertadas y limitadas a un máximo de 40 personas por turno. Duración: 60 minutos aproximadamente. Compra de entradas y reserva de horarios a través de la web: https://entradasmuseo.emtmadrid.es/?lang=es-ES.";"Si tiene una discapacidad física o sensorial, contacta con el Museo antes de reservar la visita y le informarán de la accesibilidad a la instalación.";"Metro: Begoña (línea 10). Bus: 66, 173, 174, 176, 191, 193, 194, 195, 196, 197, 712, 713, 714, 716, L171.";"";"0";"http://www.madrid.es/sites/v/index.jsp?vgnextchannel=bfa48ab43d6bb410VgnVCM100000171f5a0aRCRD&vgnextoid=d56ad05b2a255510VgnVCM2000001f4a900aRCRD";"MAURICIO LEGENDRE";"CALLE";"V";"40";"";"";"";"";"MADRID";"MADRID";"28046";"6";"CASTILLA";"5";"CHAMARTIN";"442096";"4481278";"40.480173612860305";"-3.6831595451893273";"914 068 810";"";"";"/contenido/entidadesYorganismos/AyuntamientoMadrid/OrganismosEmpresasMunicipales"; 
10237457;"Museo Félix Cañada";"Una selección de más de quinientas obras de arte de entre las cerca de mil de la donación original, constituyen la Colección Permanente que se puede visitar en las salas del Museo Félix Cañada de la Fundación Gómez Pardo, adscrita a la Escuela Técnica Superior de Ingenieros de Minas y Energía de la Universidad Politécnica de Madrid. Donada por el ingeniero de minas Doctor Félix Cañada Guerrero a la Fundación Gómez Pardo, reúne una amplia representación de trabajos de destacados artistas, pintores, escultores, ilustradores, grabadores, orfebres, ceramistas, etc. abarcando diferentes periodos desde el siglo XI hasta nuestros días.";"Lunes, miércoles y viernes, de 10 a 13 horas. .";"";"Metro: Rios Rosas (línea 1).  Bus: 45, 12, 149, 3, 37.  Bicimad: Estación 130 (calle Santa Engracia, 127).";"";"3";"http://www.madrid.es/sites/v/index.jsp?vgnextchannel=bfa48ab43d6bb410VgnVCM100000171f5a0aRCRD&vgnextoid=cb22820a52799510VgnVCM1000001d4a900aRCRD";"ALENZA";"CALLE";"V";"1";"";"";"";"";"MADRID";"MADRID";"28003";"5";"RIOS ROSAS";"7";"CHAMBERI";"440568";"4477117";"40.442581673356834";"-3.700796192332983";"914 417 921";"914 729 529";"museo@fgomezpardo.es";"/contenido/entidadesYorganismos/Museos"; 
2074;"Museo Geominero";"Los objetivos del Museo Geominero son conservar, investigar y difundir la riqueza y diversidad del patrimonio geológico, paleontológico y mineralógico a través de las importantes colecciones de minerales, rocas y fósiles procedentes de todas las regiones españolas y de antiguos territorios coloniales, así como de yacimientos significados del registro mundial.";"De lunes a domingo y festivos de 9 a 14 horas. Cerrado los días 1 y 6 de enero y 24, 25 y 31 de diciembre.";"";"Metro: Ríos Rosas (línea 1), Alonso Cano (línea 7), Cuatro Caminos (líneas 1, 2 y 6).  Bus: 45, 12, 149, 3, 37, 5.  Bicimad: Estación 130 (calle Santa Engracia, 127).";"";"3";"http://www.madrid.es/sites/v/index.jsp?vgnextchannel=bfa48ab43d6bb410VgnVCM100000171f5a0aRCRD&vgnextoid=ff0bef4d7f71c010VgnVCM1000000b205a0aRCRD";"RIOS ROSAS";"CALLE";"V";"23";"";"";"";"";"MADRID";"MADRID";"28003";"5";"RIOS ROSAS";"7";"CHAMBERI";"440663";"4477057";"40.442047952073665";"-3.699670468881422";"913 495 759";"";"m.geominero@igme.es";"/contenido/entidadesYorganismos/Museos"; 
2075;"Museo Histórico Minero Don Felipe de Borbón y Grecia";"Ubicado en la Escuela Técnica Superior de Ingenieros de Minas de Madrid";"Consultar.";"";"Metro: Ríos Rosas (línea 1)  Bus: 3, 12, 37, 45, 149  Bicimad: Estación 130 (calle Santa Engracia, 127)";"";"3";"http://www.madrid.es/sites/v/index.jsp?vgnextchannel=bfa48ab43d6bb410VgnVCM100000171f5a0aRCRD&vgnextoid=822bef4d7f71c010VgnVCM1000000b205a0aRCRD";"RIOS ROSAS";"CALLE";"V";"21";"";"";"";"";"MADRID";"MADRID";"28003";"5";"RIOS ROSAS";"7";"CHAMBERI";"440603";"4477062";"40.44209227424258";"-3.7003734646151534";"910 676 304";"";"";"/contenido/entidadesYorganismos/Museos"; 
18176;"Museo ICO";"";"De martes a sábados: de 11 a 20 horas.   Domingos y festivos: de 10 a 14 horas.    Cerrado: Todos los lunes del año.  Horarios especiales: 24 y 31 de diciembre de 10 a 14 horas. 1 de enero, 1 de mayo y 25 de diciembre cerrado.";"";"Metro: Sevilla (línea 2)  Bus: 53, 15, 20, 002, 51, M1, 150, 5  Bicimad: estación 28 (calle Alcalá, 27)  Aparcamiento: Cortes (46), Plaza de las Cortes / Hub de Movilidad Canalejas 360 (1239), Calle de Alcalá, 17 / Sevilla (41), calle Sevilla y calle Alcalá";"";"3";"http://www.madrid.es/sites/v/index.jsp?vgnextchannel=bfa48ab43d6bb410VgnVCM100000171f5a0aRCRD&vgnextoid=2886444a2951c010VgnVCM2000000c205a0aRCRD";"ZORRILLA";"CALLE";"V";"3";"";"";"";"";"MADRID";"MADRID";"28014";"3";"CORTES";"1";"CENTRO";"440806";"4474249";"40.41676546905435";"-3.6977222605477635";"914 201 242";"";"museoico@ico.es";"/contenido/entidadesYorganismos/Museos"; 
6019032;"Museo Los Caños del Peral. Estación de Metro Ópera";"A diez metros bajo la plaza de Isabel II, la estación de Metro Ópera (L2, L5 y Ramal Norte) alberga la recreación museística de la histórica fuente de los Caños del Peral. La visita nos permite conocer la fuente que recogía el agua de manantial junto al arroyo del Arenal durante la segunda mitad del sigloXVI, y que tenía en origen 34 metros de longitud; la galería de abastecimiento en bóveda de cañón y la alcantarilla de la zona; y el acueducto que, salvando al barranco del arroyo del Arenal, surtió de agua al Palacio Real desde el siglo XVII hasta prácticamente el siglo XX.";"Previa reserva en la página museosmetromadrid.es.  Viernes: de 16 a 20 horas. Sábados: de 10 a 14 horas y de 16 a 20 horas. Domingos: de 10 a 14 horas.";"";"Metro: Ópera (líneas 2, 5 y Ramal).   Bicimad: Estación 24 (calle Carlos III, 1).    Aparcamiento: Descalzas (20), plaza Descalzas y plaza San Martín.";"";"1";"http://www.madrid.es/sites/v/index.jsp?vgnextchannel=bfa48ab43d6bb410VgnVCM100000171f5a0aRCRD&vgnextoid=435950262d50f210VgnVCM2000000c205a0aRCRD";"ISABEL II";"PLAZA";"V";"1";"";"";"";"";"MADRID";"MADRID";"28013";"1";"PALACIO";"1";"CENTRO";"439834";"4474367";"40.41775560280743";"-3.709202070089538";"644 169 531";"";"info@museosmetromadrid.es";"/contenido/entidadesYorganismos/Museos"; 
2053;"Museo Lázaro Galdiano";"";"Martes a domingo, de 9:30 a 15 horas. Lunes cerrado.";"";"Metro: Gregorio Marañón (líneas 7 y 10), Ruben Darío (línea 5), Nuñez de Balboa (líneas 5 y 9)  Bus: 16, 19, 51, 9, 12, 61  Bicimad: Estaciones 140 (calle Velázquez, 130), 141 (paseo de la Castellana, 43)  Aparcamiento: Serrano I (62) calle Serrano entre Hermanos Becquer y Marqués de Villamejor";"";"1";"http://www.madrid.es/sites/v/index.jsp?vgnextchannel=bfa48ab43d6bb410VgnVCM100000171f5a0aRCRD&vgnextoid=7d1aef4d7f71c010VgnVCM1000000b205a0aRCRD";"SERRANO";"CALLE";"V";"122";"";"";"";"";"MADRID";"MADRID";"28006";"6";"CASTELLANA";"4";"SALAMANCA";"441802";"4476460";"40.43675593917329";"-3.6861820403705816";"915 616 084";"915 617 793";"";"/contenido/entidadesYorganismos/MonumentosEdificiosArtisticos"; 
5349304;"Museo Nacional Centro de Arte Reina Sofía (MNCARS)";"Edificio Sabatini: calle Santa Isabel 52.  Edificio Nouvel (ampliación): ronda de Atocha, esquina a plaza del Emperador Carlos V.  Espacios en el parque del Retiro: Palacio de Velázquez y Palacio de Cristal.";"Lunes y de miércoles a sábado, de 10 a 21 horas. Martes cerrado (incluso festivos). Domingos de 10 a 14:30 horas. Días de cierre 1 y 6 de enero, 1 de mayo, 15 de mayo, 9 de noviembre, 24, 25 y 31 de diciembre.";"";"Metro: Estación del Arte (línea 1).  Bus: 27, 34, C03, C1, 26, 32, 6, 59, 85, E1, C2, 119, 36, 41, 001, 10, 14, 37, 45.  Cercanías Renfe: Atocha (líneas C1, C2, C3, C4, C4a, C4b, C5, C7, C8, C10).  Bicimad: Estación 50 (calle Santa Isabel, 57), 51 (Ronda de Atocha, 2).  Aparcamiento: Sánchez Bustillo (37), calle Sánchez Bustillo.";"";"1";"http://www.madrid.es/sites/v/index.jsp?vgnextchannel=bfa48ab43d6bb410VgnVCM100000171f5a0aRCRD&vgnextoid=69d8275bad5a1210VgnVCM2000000c205a0aRCRD";"SANTA ISABEL";"CALLE";"V";"52";"";"";"";"";"MADRID";"MADRID";"28012";"2";"EMBAJADORES";"1";"CENTRO";"441118";"4473345";"40.40864029339671";"-3.6939504103293244";"917 741 000";"";"info@museoreinasofia.es";"/contenido/entidadesYorganismos/Museos"; 
