PK,NOMBRE,DESCRIPCION-ENTIDAD,HORARIO,METRO,BUS,RENFE,ACCESIBILIDAD,CONTENT-URL,DIRECCION,NUM,DISTRITO,LATITUD,LONGITUD,TELEFONO,EMAIL,TIPO
4847190,Casa Museo Lope de Vega,"'Mi casilla, mi quietud, mi g&amp;uuml;ertecillo y estudio'. Así define su casa Félix Lope de Vega (1562-1635) en una carta dirigida a un amigo. Situada en pleno centro histórico, en el Barrio de las Letras, la Casa Museo Lope de Vega se ubica en el edificio donde el escritor vivió sus últimos 25 años. La recreación de ambientes, cuyo objetivo es que se respire la presencia de Lope, evoca la vida cotidiana del Siglo de Oro y nos acerca a su intimidad. El equipamiento de la casa incorpora obras de arte, mobiliario, enseres y ediciones bibliográficas vinculadas al literato y su tiempo. ","De martes a domingo, de 10 a 18 horas.  Cerrado los lunes, días 1 y 6 de enero, 1 de mayo, 9 de noviembre y 24, 25 y 31 de diciembre. El acceso al museo se hace mediante visitas guiadas en grupo. Es imprescindible reservar con antelación, por teléfono o correo electrónico.","Antón Martín (línea 1), Sevilla (línea 2), Sol (líneas 1, 2 y 3).   "," 002, M1, 001, 10, 14, 27, 34, 37, 45, C03, 26, 32, 6, 51,   ",  Sol (líneas C3 y C4).    ,"NOT_ACCESSIBLE,SIGN_LANGUAGE",http://www.madrid.es/sites/v/index.jsp?vgnextchannel=bfa48ab43d6bb410VgnVCM100000171f5a0aRCRD&vgnextoid=4eff8c46145e8110VgnVCM2000000c205a0aRCRD,CALLE_CERVANTES,11,CENTRO,40.414358466555235,-3.6974741545860015,914 299 216,casamuseolopedevega@madrid.org,Museos
4949641,Casita - Museo del Ratón Pérez,"La Casita-Museo de Ratón Pérez, constituye un singular lugar que da la bienvenida a cuantos visitantes allí acuden con el deseo de conocer y encontrarse con este extraordinario, único, madrileño y universal ratón. Reserva de entradas presicialmente y a través de  whatsapp  634 742 768.",Visitas:     Lunes: 11 a 14 horas.   Martes a viernes: 11 a 14 y 17 a 20 horas.   Sábados: 11 a 14:30 y 16 a 20 horas.   Domingos y festivos: 11 a 14:30 y 16 a 20 horas (cerrado 25 de diciembre y 1 y 6 de enero).,"Sol (líneas: 1, 2 y 3), Ópera (líneas 2, 5 y Ramal Ópera Príncipe Pío), Callao (líneas 3, 5).   ", 50.  ," Sol (líneas C3, C4, C4a, C4b y Regional).   ",NOT_ACCESSIBLE,http://www.madrid.es/sites/v/index.jsp?vgnextchannel=bfa48ab43d6bb410VgnVCM100000171f5a0aRCRD&vgnextoid=990950e86d4ca110VgnVCM2000000c205a0aRCRD,CALLE_ARENAL,8,CENTRO,40.4170597715272,-3.7055199334442492,915 226 968,info@casamuseoratonperez.es,Museos
5682031,Castillo de la Alameda,"El Castillo de la Alameda o de Barajas se trata de uno de los escasos vestigios de la arquitectura militar del pasado siglo XV y uno de los pocos castillos que ha sobrevivido al paso del tiempo. Bajo él y su entorno, existen restos de asentamientos antiguos desde la Edad del Bronce hasta la Época Romana.En el edificio se realizan talleres para escolares y actividades en verano. Accesibilidad   Rampas de acceso (las rampas de acceso en estos momentos están inhabilitadas) Aseos adaptados para personas con movilidad reducida. Información en Braille para personas con discapacidad visual.","Abierto solo en fin de semana (sábado y domingo) y festivos (lunes festivos incluidos)  Del 1 de abril al 15 de junio de 10 a 21 horas. Del 16 de junio al 15 de septiembre de 10 a 20 horas. Del 15 al 30 de septiembre de 10 a 21 horas. De octubre a marzo de 10 a 18 horas.  Cerrado: 1 y 6 de enero, 1 de mayo, 24, 25 y 31 de diciembre.",Alameda de Osuna y El Capricho (línea 5).  ," 101, 105, 112, 114, 115 y 151.",,"ACCESSIBLE,MAGNETIC_LOOP",http://www.madrid.es/sites/v/index.jsp?vgnextchannel=bfa48ab43d6bb410VgnVCM100000171f5a0aRCRD&vgnextoid=fe43c4be8e688210VgnVCM1000000b205a0aRCRD,CALLE_ANTONIO SANCHA,1,BARAJAS,40.45835460563491,-3.5932903820278788,913 667 415,castilloalameda@madrid.es,MonumentosEdificiosArtisticos
2064,Casón del Buen Retiro.,"El Centro de Estudios del Prado está ubicado en el Casón del Buen Retiro, que aloja además la Biblioteca, el Archivo, el Centro de Documentación y los Departamentos de Conservación del Museo Nacional del Prado. Descripción monumental  El Casón o Salón de Baile es el único volumen que permanece del antiguo Palacio del buen Retiro, ejecutado en 1637 con un proyecto de Alonso Carbonel. Aún se conserva la bóveda de cañon con lunetas, pintada al fresco por Lucas Jordán en 1692 con la Alegoría del Toisón de Oro. Su fachada principal, a poniente, arrasada la primitiva en 1886 por un ciclón, es de Velázquez Bosco. La última rehabilitación ha sido realizada por Jaime Torruell.",,"Estación del Arte (línea 1), Banco de España (línea 2).   ", 19.  ," Atocha (líneas C1, C2, C3, C4, C4a, C4b, C5, C7 y C10).   ",ACCESSIBLE,http://www.madrid.es/sites/v/index.jsp?vgnextchannel=bfa48ab43d6bb410VgnVCM100000171f5a0aRCRD&vgnextoid=f0443d0b5e71c010VgnVCM1000000b205a0aRCRD,CALLE_ALFONSO XII,28,RETIRO,40.41527545361461,-3.689222446432277,,centro.estudios@museodelprado.es,MonumentosEdificiosArtisticos
2069,Centro Cultural La Corrala. Museo de Artes y Tradiciones Populares,,"Lunes a viernes de 10 a 20 horas. Sábados de 10 a 14 horas. Cerrado domingos, festivos y mes de agosto, 24 y 31 diciembre.",La Latina (línea 5)   ," 002, 17, 18, 23, 35, 60.   ",,NO_INFORMATION,http://www.madrid.es/sites/v/index.jsp?vgnextchannel=bfa48ab43d6bb410VgnVCM100000171f5a0aRCRD&vgnextoid=5c39ef4d7f71c010VgnVCM1000000b205a0aRCRD,CALLE_CARLOS ARNICHES,3,CENTRO,40.408827275648434,-3.7083241323093614,914 976 500,museoatp@uam.es / lacorrala@uam.es,Museos
6469186,Ermita de San Antonio de la Florida (Museo),"Ermita dedicada a San Antonio de Padua y pequeño museo. Las pinturas murales que la decoran son de Francisco de Goya. Alberga los restos mortales del artista desde 1919. Para preservar sus pinturas, en 1929 se trasladó el culto a una ermita gemela construida a su lado, dejando el edificio original como museo. ","General   De martes a domingos de 9:30 a 20 horas.   Verano (del 15 de junio al 15 de septiembre)   De martes a viernes de 9:30 a 14 horas y de 15 a 19 horas. Sábados y domingos de 9:30 a 19 horas.   Cerrado:  lunes (incluidos festivos), 1 y 6 de enero, 1 de mayo, 24, 25 y 31 de diciembre.  Último pase de visita: 20 minutos antes del cierre (el desalojo de las salas comenzará 10 minutos antes) Este horario y la apertura de salas pueden sufrir modificaciones.","Príncipe Pío (líneas 5, 10 y ramal Ópera - Príncipe Pío)   "," 41, 46 y 75 (Intercambiador Príncipe Pío)  ", Príncipe Pío  BICIMAD: Estación 161 (Paseo de la Florida 8),"PARTIALLY_ACCESSIBLE,MAGNETIC_LOOP",http://www.madrid.es/sites/v/index.jsp?vgnextchannel=bfa48ab43d6bb410VgnVCM100000171f5a0aRCRD&vgnextoid=75950204770e7310VgnVCM2000000c205a0aRCRD,GLORIETA_SAN ANTONIO DE LA FLORIDA,5,MONCLOA-ARAVACA,40.425256682855846,-3.725725718176111,915 420 722 o 683 429 760,sanantonio@madrid.es,MonumentosEdificiosArtisticos
58353,Espacio Fundación Telefónica,,"De martes a domingo, de 10 a 20 horas. Cerrado al público todos los lunes y días 25 de diciembre, 1 y 6 de enero.",Gran Vía (líneas 1 y 5).   ," 001, 002, 1, 146, 2, 46, 74, 3.   ",,ACCESSIBLE,http://www.madrid.es/sites/v/index.jsp?vgnextchannel=bfa48ab43d6bb410VgnVCM100000171f5a0aRCRD&vgnextoid=87748ed67151c010VgnVCM2000000c205a0aRCRD,CALLE_FUENCARRAL,3,CENTRO,40.42042493125648,-3.701594573150366,915 808 700 (información general) / 659 158 011 (visitas guiadas y talleres educativos),espacio@fundaciontelefonica.com,Museos
6017808,Fundación AMYC (Arte Moderno y Contemporáneo). Casa Museo Fuente del Rey,,"Martes a sábado, de 10 a 19 horas. Lunes, domingos y festivos cerrado. Visitas para grupos de hasta 25 personas dentro de los horarios de apertura. Pueden ser con guía propio o con guía de la Fundación, y la duración de la misma es de una hora, previa reserva telefónica o por email.",, 161.,,NO_INFORMATION,http://www.madrid.es/sites/v/index.jsp?vgnextchannel=bfa48ab43d6bb410VgnVCM100000171f5a0aRCRD&vgnextoid=5c1260101310f210VgnVCM1000000b205a0aRCRD,CALLE_FUENTE DEL REY,11,MONCLOA-ARAVACA,40.45546866305681,-3.7705716814130965,913 579 116,info@fundacionamyc.org,FundacionesCulturales
103331,La Casa Encendida de la Fundación Montemadrid,"Edificio de carácter monumental. De estilo neomudéjar, fue diseñado por el arquitecto Fernando Arbós e inaugurado en el año 1913. Cuenta con más de 6000 metros cuadrados de instalaciones divididas en 4 plantas y una azotea. Centro social y cultural. ",De martes a domingo de 10 a 22 horas.,Embajadores (línea 3)   ," 119, 27, 34, 36, 41, C03, C2, C1, 148, 60, 75, M1  ", Embajadores (línea C5)   ,"ACCESSIBLE,SIGN_LANGUAGE,MAGNETIC_LOOP",http://www.madrid.es/sites/v/index.jsp?vgnextchannel=bfa48ab43d6bb410VgnVCM100000171f5a0aRCRD&vgnextoid=c27f8899fc81c010VgnVCM1000000b205a0aRCRD,RONDA_VALENCIA,2,CENTRO,40.40596221830597,-3.6997720739017033,902 430 322,,MonumentosEdificiosArtisticos
5873478,Museo ABC,"Centro de arte, dibujo e ilustración. ",Consultar.,"San Bernardo (líneas 2, 4), Noviciado (línea 2), Ventura Rodríguez (línea 3), Plaza de España (líneas 3, 10)   "," M2, C1, C3, 1, 2, 3, 21, 44, 133, 147, 001, 002    ",,ACCESSIBLE,http://www.madrid.es/sites/v/index.jsp?vgnextchannel=bfa48ab43d6bb410VgnVCM100000171f5a0aRCRD&vgnextoid=f0103fee6537c210VgnVCM1000000b205a0aRCRD,CALLE_AMANIEL,29,CENTRO,40.42741121610518,-3.709539260414957,917 588 379,info_museo@abc.es,Museos
2067,Museo Africano Misioneros Combonianos,,Grupos con cita previa telefónica o en la su web : de lunes a viernes de 9:30 a 13:30 horas.  Individuales: Visitas guiadas sin cita previa los domingos a las 11:30 horas.,," 11, 70, 114, 122, 115, 200.",,NO_INFORMATION,http://www.madrid.es/sites/v/index.jsp?vgnextchannel=bfa48ab43d6bb410VgnVCM100000171f5a0aRCRD&vgnextoid=6ab8ef4d7f71c010VgnVCM1000000b205a0aRCRD,CALLE_ARTURO SORIA,101,CIUDAD_LINEAL,40.44946738556641,-3.651489872602189,914 152 412,,Museos
2050,Museo Arqueológico Nacional,"Fundado en 1867, el MAN se inauguró en 1895 en su actual sede, en el Palacio de Biblioteca y Museos, edificio proyectado por Francisco Jareño y terminado por Antonio Ruiz de Salces. ","De martes a sábados de 9:30 a 20 horas. Domingos y festivos de 9:30 a 15 horas.   Cerrado   Todos los lunes del año. 1 y 6 de enero, 1 de mayo, 9 de noviembre, 24, 25 y 31 de diciembre.  Más información horarios.","Serrano (línea 4), Retiro (línea 2)   "," 1, 9, 19, 51, 74  "," Recoletos (línea C1, C2, C7, C10 y Regional)   ","ACCESSIBLE,MAGNETIC_LOOP",http://www.madrid.es/sites/v/index.jsp?vgnextchannel=bfa48ab43d6bb410VgnVCM100000171f5a0aRCRD&vgnextoid=8fd8ef4d7f71c010VgnVCM1000000b205a0aRCRD,CALLE_SERRANO,13,SALAMANCA,40.4232789604228,-3.6884121235090532,915 777 912,,Museos
2072,Museo Casa de la Moneda,,"De martes a viernes ininterrumpidamente de 10 a 17:30. Sábados, domingos y festivos de 10 a 14:15 horas. Cerrado los lunes (incluidos festivos), y los días 1 y 6 de enero; 1 de mayo; 24, 25 y 31 de diciembre.","O&amp;acute;Donnell (línea 6), Goya (líneas 2 y 4).   "," 143, 156, 2, 30, 56, 71, C2, 28, 203.    ",,"ACCESSIBLE,SIGN_LANGUAGE",http://www.madrid.es/sites/v/index.jsp?vgnextchannel=bfa48ab43d6bb410VgnVCM100000171f5a0aRCRD&vgnextoid=12f8ef4d7f71c010VgnVCM1000000b205a0aRCRD,CALLE_DOCTOR ESQUERDO,36,SALAMANCA,40.42260021542579,-3.669139860245996,915 666 544,,Museos
4112,Museo Cerralbo,"Este Palacio, construido entre 1883 y 1893, fue concebido como vivienda y como museo para sede de las obras de arte reunidas por los Marqueses de Cerralbo y sus hijos, los Marqueses de Villa Huerta, durante los numerosos viajes que realizaron por España y Europa. ","De martes a sábado de 9:30 a 15 horas. Jueves, apertura extraordinaria por la tarde, de 17 a 20 horas, excepto festivos. Entrada gratuita. Domingos y festivos de 10 a 15 horas. Domingos, entrada gratuita para todo el público. Cerrado: todos los lunes, 1 y 6 de enero, 1 de mayo, 24, 25 y 31 de diciembre, una fiesta local.","Plaza de España (líneas 3, 10), Príncipe Pío (líneas 6 y 10)   "," 62, 74  "," Príncipe Pio (líneas C1, C7 y C10)   ","PARTIALLY_ACCESSIBLE,MAGNETIC_LOOP",http://www.madrid.es/sites/v/index.jsp?vgnextchannel=bfa48ab43d6bb410VgnVCM100000171f5a0aRCRD&vgnextoid=a4efb0c40971c010VgnVCM1000000b205a0aRCRD,CALLE_VENTURA RODRIGUEZ,17,MONCLOA-ARAVACA,40.423779252051425,-3.7145996063573756,915 473 646 / 915 473 647,museo.cerralbo@cultura.gob.es,Museos
10091450,Museo EMT,"El Museo de la EMT se ha convertido en realidad tras una década de duro trabajo de recuperación, restauración y reparación del patrimonio histórico de la Empresa Municipal de Transportes de Madrid, especialmente, material móvil, mobiliario, piezas mecánicas, maquinaria y otros elementos inherentes a la actividad de la EMT en sus 70 años de historia.  Página web:  https://museo.emtmadrid.es/ ","Visitas (con cita previa)  Apertura estacional durante seis meses al año: todos los sábados de abril, mayo, junio, julio, septiembre y octubre), a las 10, a las 11:30 y a las 13 horas. Por ser un centro de trabajo únicamente pueden realizarse de forma organizada, previamente concertadas y limitadas a un máximo de 40 personas por turno. Duración: 60 minutos aproximadamente. Compra de entradas y reserva de horarios a través de la web: https://entradasmuseo.emtmadrid.es/?lang=es-ES.",Begoña (línea 10).  ," 66, 173, 174, 176, 191, 193, 194, 195, 196, 197, 712, 713, 714, 716, L171.",,NOT_ACCESSIBLE,http://www.madrid.es/sites/v/index.jsp?vgnextchannel=bfa48ab43d6bb410VgnVCM100000171f5a0aRCRD&vgnextoid=d56ad05b2a255510VgnVCM2000001f4a900aRCRD,CALLE_MAURICIO LEGENDRE,40,CHAMARTIN,40.480173612860305,-3.6831595451893273,914 068 810,,AyuntamientoMadrid/OrganismosEmpresasMunicipales
10237457,Museo Félix Cañada,"Una selección de más de quinientas obras de arte de entre las cerca de mil de la donación original, constituyen la Colección Permanente que se puede visitar en las salas del Museo Félix Cañada de la Fundación Gómez Pardo, adscrita a la Escuela Técnica Superior de Ingenieros de Minas y Energía de la Universidad Politécnica de Madrid. Donada por el ingeniero de minas Doctor Félix Cañada Guerrero a la Fundación Gómez Pardo, reúne una amplia representación de trabajos de destacados artistas, pintores, escultores, ilustradores, grabadores, orfebres, ceramistas, etc. abarcando diferentes periodos desde el siglo XI hasta nuestros días. ","Lunes, miércoles y viernes, de 10 a 13 horas. .",Rios Rosas (línea 1).   ," 45, 12, 149, 3, 37.   ",,NO_INFORMATION,http://www.madrid.es/sites/v/index.jsp?vgnextchannel=bfa48ab43d6bb410VgnVCM100000171f5a0aRCRD&vgnextoid=cb22820a52799510VgnVCM1000001d4a900aRCRD,CALLE_ALENZA,1,CHAMBERI,40.442581673356834,-3.700796192332983,914 417 921,museo@fgomezpardo.es,Museos
2074,Museo Geominero,"Los objetivos del Museo Geominero son conservar, investigar y difundir la riqueza y diversidad del patrimonio geológico, paleontológico y mineralógico a través de las importantes colecciones de minerales, rocas y fósiles procedentes de todas las regiones españolas y de antiguos territorios coloniales, así como de yacimientos significados del registro mundial. ","De lunes a domingo y festivos de 9 a 14 horas. Cerrado los días 1 y 6 de enero y 24, 25 y 31 de diciembre.","Ríos Rosas (línea 1), Alonso Cano (línea 7), Cuatro Caminos (líneas 1, 2 y 6).   "," 45, 12, 149, 3, 37, 5.   ",,NO_INFORMATION,http://www.madrid.es/sites/v/index.jsp?vgnextchannel=bfa48ab43d6bb410VgnVCM100000171f5a0aRCRD&vgnextoid=ff0bef4d7f71c010VgnVCM1000000b205a0aRCRD,CALLE_RIOS ROSAS,23,CHAMBERI,40.442047952073665,-3.699670468881422,913 495 759,m.geominero@igme.es,Museos
2075,Museo Histórico Minero Don Felipe de Borbón y Grecia,Ubicado en la Escuela Técnica Superior de Ingenieros de Minas de Madrid ,Consultar.,Ríos Rosas (línea 1)   ," 3, 12, 37, 45, 149   ",,NO_INFORMATION,http://www.madrid.es/sites/v/index.jsp?vgnextchannel=bfa48ab43d6bb410VgnVCM100000171f5a0aRCRD&vgnextoid=822bef4d7f71c010VgnVCM1000000b205a0aRCRD,CALLE_RIOS ROSAS,21,CHAMBERI,40.44209227424258,-3.7003734646151534,910 676 304,,Museos
18176,Museo ICO,,"De martes a sábados: de 11 a 20 horas.   Domingos y festivos: de 10 a 14 horas.    Cerrado: Todos los lunes del año.  Horarios especiales: 24 y 31 de diciembre de 10 a 14 horas. 1 de enero, 1 de mayo y 25 de diciembre cerrado.",Sevilla (línea 2)   ," 53, 15, 20, 002, 51, M1, 150, 5   ",,NO_INFORMATION,http://www.madrid.es/sites/v/index.jsp?vgnextchannel=bfa48ab43d6bb410VgnVCM100000171f5a0aRCRD&vgnextoid=2886444a2951c010VgnVCM2000000c205a0aRCRD,CALLE_ZORRILLA,3,CENTRO,40.41676546905435,-3.6977222605477635,914 201 242,museoico@ico.es,Museos
6019032,Museo Los Caños del Peral. Estación de Metro Ópera,"A diez metros bajo la plaza de Isabel II, la estación de Metro Ópera (L2, L5 y Ramal Norte) alberga la recreación museística de la histórica fuente de los Caños del Peral. La visita nos permite conocer la fuente que recogía el agua de manantial junto al arroyo del Arenal durante la segunda mitad del sigloXVI, y que tenía en origen 34 metros de longitud; la galería de abastecimiento en bóveda de cañón y la alcantarilla de la zona; y el acueducto que, salvando al barranco del arroyo del Arenal, surtió de agua al Palacio Real desde el siglo XVII hasta prácticamente el siglo XX. ",Previa reserva en la página museosmetromadrid.es.  Viernes: de 16 a 20 horas. Sábados: de 10 a 14 horas y de 16 a 20 horas. Domingos: de 10 a 14 horas.,"Ópera (líneas 2, 5 y Ramal).    ",,,ACCESSIBLE,http://www.madrid.es/sites/v/index.jsp?vgnextchannel=bfa48ab43d6bb410VgnVCM100000171f5a0aRCRD&vgnextoid=435950262d50f210VgnVCM2000000c205a0aRCRD,PLAZA_ISABEL II,1,CENTRO,40.41775560280743,-3.709202070089538,644 169 531,info@museosmetromadrid.es,Museos
2053,Museo Lázaro Galdiano,,"Martes a domingo, de 9:30 a 15 horas. Lunes cerrado.","Gregorio Marañón (líneas 7 y 10), Ruben Darío (línea 5), Nuñez de Balboa (líneas 5 y 9)   "," 16, 19, 51, 9, 12, 61   ",,ACCESSIBLE,http://www.madrid.es/sites/v/index.jsp?vgnextchannel=bfa48ab43d6bb410VgnVCM100000171f5a0aRCRD&vgnextoid=7d1aef4d7f71c010VgnVCM1000000b205a0aRCRD,CALLE_SERRANO,122,SALAMANCA,40.43675593917329,-3.6861820403705816,915 616 084,,MonumentosEdificiosArtisticos
5349304,Museo Nacional Centro de Arte Reina Sofía (MNCARS),"Edificio Sabatini: calle Santa Isabel 52.  Edificio Nouvel (ampliación): ronda de Atocha, esquina a plaza del Emperador Carlos V.  Espacios en el parque del Retiro: Palacio de Velázquez y Palacio de Cristal. ","Lunes y de miércoles a sábado, de 10 a 21 horas. Martes cerrado (incluso festivos). Domingos de 10 a 14:30 horas. Días de cierre 1 y 6 de enero, 1 de mayo, 15 de mayo, 9 de noviembre, 24, 25 y 31 de diciembre.",Estación del Arte (línea 1).   ," 27, 34, C03, C1, 26, 32, 6, 59, 85, E1, C2, 119, 36, 41, 001, 10, 14, 37, 45.  "," Atocha (líneas C1, C2, C3, C4, C4a, C4b, C5, C7, C8, C10).   ",ACCESSIBLE,http://www.madrid.es/sites/v/index.jsp?vgnextchannel=bfa48ab43d6bb410VgnVCM100000171f5a0aRCRD&vgnextoid=69d8275bad5a1210VgnVCM2000000c205a0aRCRD,CALLE_SANTA ISABEL,52,CENTRO,40.40864029339671,-3.6939504103293244,917 741 000,info@museoreinasofia.es,Museos
2099,Museo Nacional Thyssen-Bornemisza,"El palacio donde se ubica la colección fue el antiguo palacio del duque de Villahermosa. Edificación neoclásica. Posteriormente se adapta como entidad bancaria perdiento sus espacios interiores. Más tarde, pasó a formar parte de los edificios del Museo del Prado. Desde principios de los 90 alberga la Colección Thyssen. El museo ofrece un recorrido por la historia de la pintura europea desde sus inicios en el siglo XIII, hasta finales del siglo XX. Arquitecto: Antonio López Aguado (1805 - 1806).  Adecuación: Rafael Moneo (1989 - 1992).  Ampliación: BOPBAA (1999 - 2004).","Colecciones permanentes:  lunes de 12 a 16 horas (acceso gratuito gracias al patrocinio de MasterCard). Martes a domingo de 10 a 19 horas.   Exposiciones temporales: consultar horario específico en la web del museo.  Avisos y aperturas extraordinarias: los días 1 de enero, 1 de mayo y 25 de diciembre el Museo permanecerá cerrado. El 24 y el 31 de diciembre el horario de apertura del Museo será de 10 a 15 horas.  El desalojo de las salas tendrá lugar 5 minutos antes del cierre.",Banco de España (línea 2).   ," 001, 10, 14, 27, 34, 37, 45, C03.    ",,ACCESSIBLE,http://www.madrid.es/sites/v/index.jsp?vgnextchannel=bfa48ab43d6bb410VgnVCM100000171f5a0aRCRD&vgnextoid=0b8079262ef5d010VgnVCM1000000b205a0aRCRD,PASEO_PRADO,8,CENTRO,40.41601631762229,-3.694738346891257,917 911 370,cavthyssen@museothyssen.org,MonumentosEdificiosArtisticos
2057,Museo Nacional de Antropología,"El Museo está instalado en el edificio de estilo clasicista construido por el Marqués de Cubas en 1875 por encargo del Doctor González Velasco, fundador de la institución. ","De martes a sábado de 9:30 a 20 horas. Domingos: de 10 a 15 horas. Cerrado todos los lunes del año y los días 1 y 6 de enero, 1 de mayo, 24, 25 y 31 de diciembre y un festivo local. La taquilla se cerrará 15 minutos antes del cierre.",Estación del Arte (línea 1).   ," 19, C1, 10, 14, 26, 32, 102, 37, 001, C2, 59, SE760, 203, 85, 141, 54, 57.  "," Atocha (líneas C1, C2, C3, C4, C4a, C4b, C5, C7, C8, C10 y Regional)   ","ACCESSIBLE,MAGNETIC_LOOP",http://www.madrid.es/sites/v/index.jsp?vgnextchannel=bfa48ab43d6bb410VgnVCM100000171f5a0aRCRD&vgnextoid=456079262ef5d010VgnVCM1000000b205a0aRCRD,CALLE_ALFONSO XII,68,RETIRO,40.407887537677716,-3.688862923660605,915 306 418 / 915 395 995,antropologico@cultura.gob.es,Museos
2055,Museo Nacional de Artes Decorativas,"Inaugurado en 1912, su sede es un típico palacete madrileño del último tercio del siglo XIX. El museo posee muebles, cerámicas, vidrios, joyas, tejidos, arte oriental, y hasta 30 000 objetos distintos que a lo largo de la historia han servido para embellecer las casas, palacios y los monumentos de distintas culturas. El museo posee muestras como el Jarrón de Sevres regalo de Napoleón III, la Cocina Valenciana del siglo XVIII compuesta por más de 1500 azulejos de Manises, la Mesa de plata del siglo XVI o la colección de alfombras españolas de los siglos XV al XVII. El Museo dispone de una rampa de acceso al edificio en la calle Montalbán. Para su uso, es necesario avisar con antelación al personal del Museo.El acceso a las diferentes plantas, puede realizarse mediante ascensor. Debido a las dimensiones del mismo, es necesario emplear en él las sillas de ruedas que el Museo pone a su disposición, previa solicitud.","Martes a sábados de 9:30 a 15 horas. Domingo y festivos: de 10 a 15 horas. Jueves tarde de 17 a 20 horas (excepto julio y agosto).  Cerrado:  todos los lunes, 1 y 6 de enero, 1 y 15 de mayo, 24, 25 y 31 de diciembre.    La venta de entradas finalizará 30 minutos antes del cierre.",Banco de España (Línea 2)   ," 19, E1, 203, 14, 27, 37, 45, C03, 1, 146, 15, 2, 20, 51, 52, 74, 9, 10, 34, 001   ",,"PARTIALLY_ACCESSIBLE,MAGNETIC_LOOP",http://www.madrid.es/sites/v/index.jsp?vgnextchannel=bfa48ab43d6bb410VgnVCM100000171f5a0aRCRD&vgnextoid=287079262ef5d010VgnVCM1000000b205a0aRCRD,CALLE_MONTALBAN,12,RETIRO,40.417896616053866,-3.689754509701677,915 326 499,,MonumentosEdificiosArtisticos
2056,Museo Nacional de Ciencias Naturales,,"De martes a viernes de 10 a 17 horas. Sábados, domingos y festivos de 10 a 20 horas. Agosto,de 10 a 15 horas. Cerrado los lunes (excepto los festivos). Cerrado el 1 y 6 de enero, el 1 de mayo y el 25 de diciembre. Los días 24 y 31 de diciembre el museo permanecerá abierto de 10 a 15 horas.","Gregorio Marañón (líneas 7, 10)   "," 12, 45, 14, 147, 150, 27, 40, 7   ",,"ACCESSIBLE,MAGNETIC_LOOP",http://www.madrid.es/sites/v/index.jsp?vgnextchannel=bfa48ab43d6bb410VgnVCM100000171f5a0aRCRD&vgnextoid=8edbef4d7f71c010VgnVCM1000000b205a0aRCRD,CALLE_JOSE GUTIERREZ ABASCAL,2,CHAMARTIN,40.44042600324054,-3.690212174964136,,,MonumentosEdificiosArtisticos
2076,Museo Naval,,"De martes a domingo de 10 a 19 horas. Durante el mes de agosto, horario reducido de 10 a 15 horas. Cerrados lunes, 1 y 6 de enero, 1 de mayo, 24, 25 y 31 de diciembre.",Banco de España (línea 2)   ," 002, M1, SE712, 26, 32, 6   ",,ACCESSIBLE,http://www.madrid.es/sites/v/index.jsp?vgnextchannel=bfa48ab43d6bb410VgnVCM100000171f5a0aRCRD&vgnextoid=a30cef4d7f71c010VgnVCM1000000b205a0aRCRD,PASEO_PRADO,3,RETIRO,40.417817776538435,-3.6927096854547727,915 238 516,museonavalmadrid@fn.mde.es,Museos
2085,Museo Postal y Telegráfico,"El  Museo Postal y Telegráfico ofrece al visitante un recorrido temático y cronológico a través  de la historia de las comunicaciones, desde la más tradicional, la carta, hasta las comunicaciones por satélite. En este museo se conservan y exhiben los fondos postales y de telecomunicación desde los primeros hitos conocidos hasta nuestros días. ",Consultar,,,,ACCESSIBLE,http://www.madrid.es/sites/v/index.jsp?vgnextchannel=bfa48ab43d6bb410VgnVCM100000171f5a0aRCRD&vgnextoid=c82cef4d7f71c010VgnVCM1000000b205a0aRCRD,CALLE_TAPIA DE CASARIEGO,6,MONCLOA-ARAVACA,40.46772394620028,-3.7690769512163045,917 401 440 / 917 400 668,info@museopostalytelegrafico.com,Museos
4997114,Museo Sorolla,,"De martes a sábado: de 9:30 a 20 horas. Domingos y festivos: de 10 a 15 horas. Cerrado: todos los lunes del año, 1 y 6 de enero, 1 de mayo, 9 noviembre, 24, 25 y 31 de diciembre .","Rubén Darío (línea 5), Gregorio Marañón (líneas 7 y 10), Iglesia (línea 1).   "," 16, 5, 61, 147, 40, 7.   ",,PARTIALLY_ACCESSIBLE,http://www.madrid.es/sites/v/index.jsp?vgnextchannel=bfa48ab43d6bb410VgnVCM100000171f5a0aRCRD&vgnextoid=6dd05e93aad9c110VgnVCM1000000b205a0aRCRD,PASEO_GENERAL MARTINEZ CAMPOS,37,CHAMBERI,40.43525811195212,-3.69257053914393,913 101 584,museo.sorolla@cultura.gob.es,Museos
