PK;NOMBRE;DESCRIPCION-ENTIDAD;HORARIO;EQUIPAMIENTO;TRANSPORTE;DESCRIPCION;ACCESIBILIDAD;CONTENT-URL;NOMBRE-VIA;CLASE-VIAL;TIPO-NUM;NUM;PLANTA;PUERTA;ESCALERAS;ORIENTACION;LOCALIDAD;PROVINCIA;CODIGO-POSTAL;COD-BARRIO;BARRIO;COD-DISTRITO;DISTRITO;COORDENADA-X;COORDENADA-Y;LATITUD;LONGITUD;TELEFONO;FAX;EMAIL;TIPO;
13202;"Estación Sur de Autobuses de Madrid";"";"";"";"Metro: Méndez Álvaro (línea 6).  Bus: 102, 152, 148, 156, 8, 113.  Bicimad: Estación 269 (calle Ariel, 7).  Cercanías Renfe: Méndez Álvaro (líneas C1, C5, y C10).";"";"1,5,6";"http://www.madrid.es/sites/v/index.jsp?vgnextchannel=bfa48ab43d6bb410VgnVCM100000171f5a0aRCRD&vgnextoid=82e18a856b51c010VgnVCM1000000b205a0aRCRD";"MENDEZ ALVARO";"CALLE";"V";"83";"";"";"";"";"MADRID";"MADRID";"28045";"7";"ATOCHA";"2";"ARGANZUELA";"442369";"4471803";"40.39483972375301";"-3.679069176819924";"914 684 200";"";"";"/contenido/entidadesYorganismos/TransportePublico/EstacionesAutobus"; 
2047;"Hemeroteca Municipal";"Fundada en 1916, por iniciativa de los periodistas Ricardo Fuente y Antonio Asenjo, custodia prensa proveniente de todo el mundo hasta mediados del siglo XX. A partir de 1966 recoge, casi exclusivamente, la prensa editada en Madrid. Sus fondos abarcan una completísima colección de más de cuatro siglos de publicaciones periódicas. Destacan por su importancia las colecciones de los siglos XVII y XVIII, correspondientes a los primeros momentos de la historia de la prensa española. Abundantes y completas  son las del siglo XIX  y de la Guerra Civil,1936-1939. Son muy valiosos también, los fondos  de prensa antigua hispano- americana, francesa y alemana.";"Horario general: de lunes a viernes, de 8:30 a 20:30 horas.  Horario de verano (del 15 de junio al 31 de julio y del 1 al 15 de septiembre)  y semana de San Isidro: de lunes a viernes, de 8:30 a 19:30 horas. Agosto: lunes a viernes, de 8:30 a 14 horas (cierre de la sala 15 minutos antes). Admisión de peticiones hasta 15 minutos antes del cierre. Recogida de reprografía: lunes a viernes de 9 a 14 horas. Cerrado: festivos y los días 24 y 31 diciembre.";"Los servicios que se prestan son los siguientes:  Información general y especializada.  Consulta de fondos: colecciones en papel, microfilmadas y digitalizadas. Préstamo para exposiciones. Reproducción de documentos. Actividades culturales: visitas guiadas; exposiciones propias o en colaboración. Publicaciones. Servicios en línea. Acceso a hemerotecas digitales. Espacio Wifi.  Para consulta de los fondos es necesario la tarjeta de lector (se expide a mayores de 18 años, presentando D.N.I. o pasaporte). Pupitres adaptados para usuarios con movilidad reducida.";"Metro: San Bernardo , Ventura Rodríguez, Plaza de España, Noviciado Bus: 1, 2, 7, 21, 44, 74, 147, Circular, Minibus M-2 Bicimad: Estación 13. Calle Conde Duque n&amp;ordm;22.";"Directorio:     Dirección Teléfono: 91 588 57 74.Correo: zaragozagi@madrid.es   Secretaría Teléfono: 91 588 57 77.Correo: hemeroteca@madrid.es   Gestión económica y administrativa Teléfono: 91 588 16 12.Correo: parejopma@madrid.es   Sección Contemporánea (Publicaciones en curso) Teléfono: 91 588 57 56, 91 480 06 02 y 91 480 06 22.Correo: contemporanea@madrid.es   Sección Histórica Teléfono:Correo:  Sección Información Teléfono: 91 588 57 72 y 91 588 57 75Correo: infohemeroteca@madrid.es   Difusión Teléfono: 91 480 05 79Correo: concejodml@madrid.es   Servicio de Reprografía Teléfono: 91 588 57 73Correo:nmicrofilm@madrid.es   Recepción Teléfono: 91 588 57 71 y 91 588 57 64";"1,6";"http://www.madrid.es/sites/v/index.jsp?vgnextchannel=bfa48ab43d6bb410VgnVCM100000171f5a0aRCRD&vgnextoid=11951e79ee71c010VgnVCM1000000b205a0aRCRD";"CONDE DUQUE";"CALLE";"V";"11";"";"";"";"";"MADRID";"MADRID";"28015";"5";"UNIVERSIDAD";"1";"CENTRO";"439759";"4475508";"40.42802889001877";"-3.710182353581842";"91 588 57 71";"";"hemeroteca@madrid.es";"/contenido/entidadesYorganismos/BibliotecasEspecializadasUniversitarias"; 
79870;"Imprenta Municipal - Artes del libro";"La Imprenta Municipal-Artes del Libro, inaugurada como museo en diciembre de 2011, ofrece a la ciudadanía contenidos culturales ligados a la historia de la imprenta, del libro y de las artes asociadas a ellos. El precedente de esta institución se encuentra en la Imprenta Artesanal.  Su colección posee más de 3000 piezas procedentes de las artes gráficas. Mantiene además los talleres profesionales con impresión tipográfica y encuadernación artística y artesanal. El edificio, construcción de carácter racionalista terminada en 1933 y realizada por Javier Ferrero Lluisá y Luis Bellido, comparte entorno con algunos edificios y espacios relevantes de la ciudad.";"De martes a domingos y festivos: de 10 a 20 horas.  Semana de San Isidro:  de martes a domingo de 10 a 19 horas.   Verano: del 15 de junio al 15 de septiembre, de martes a domingos y festivos de 10 a 19 horas.   Cerrado: todos lunes y los días 1 y 6 de enero, 1 de mayo y 24, 25 y 31 de diciembre.";"Salón de actos. Biblioteca especializada y Centro de Documentación (consulta de fondos por investigadores previa cita). Préstamo para exposiciones. Venta de publicaciones. Zona wifi.";"Metro: Sol, Tirso de Molina, Latina Bus: 3, 6, 17, 18, 23, 26, 31, 32, 35, 50, 51, 60, 65, M-1 Cercanías Renfe: Sol BICIMAD: Estación 40 (Plaza de Romanones 9)";"";"1,6";"http://www.madrid.es/sites/v/index.jsp?vgnextchannel=bfa48ab43d6bb410VgnVCM100000171f5a0aRCRD&vgnextoid=26a38ed67151c010VgnVCM2000000c205a0aRCRD";"CONCEPCION JERONIMA";"CALLE";"V";"15";"";"";"";"";"MADRID";"MADRID";"28012";"2";"EMBAJADORES";"1";"CENTRO";"440146";"4473936";"40.413896825498995";"-3.7054692169323364";"914 294 881";"";"imprentamunicipal@madrid.es";""; 
12054579;"Instalación deportiva para mayores Concepción Arenal";"";"Lunes a viernes de 9 a 19:30 horas.";"Cafetería y comedor:    Horario: 9:30 a 14:45 y de 16 a 19 horas.   Talleres: Actividades físicas para personas mayores socias de varios centros municipales de mayores del distrito de Hortaleza.    Gimnasia, Taichi, Yoga, Pilates, Bailes de salón   Fiestas intercentros e intergeneracionales    Zona wifi  Al no ser un centro de mayores, las personas mayores interesadas deberán acudir para inscribirse o ser atendidas al centro del que sea socia.";"Bus: 73, 120, 125, 172, 87   Metro: Canillas (línea 4), Mar de Cristal (líneas 4 y 8)";"Requisitos para ser socio:  Ser titular de la tarjeta madridmayor.es. Para solicitar esta tarjeta vea la información relacionada. Los Centros Municipales de Mayores son equipamientos de Servicios Sociales No Residenciales, destinados a promover la convivencia de los mayores, propiciando la participación y la integración social.";"1";"http://www.madrid.es/sites/v/index.jsp?vgnextchannel=bfa48ab43d6bb410VgnVCM100000171f5a0aRCRD&vgnextoid=1c1628cecde39810VgnVCM1000001d4a900aRCRD";"JAVIER DEL QUINTO";"CALLE";"V";"12";"";"";"";"Está ubicado dentro del Centro de Servicios Sociales ?Concepción Arenal?";"MADRID";"MADRID";"28043";"3";"CANILLAS";"16";"HORTALEZA";"445557";"4479741";"40.46656244589171";"-3.6421934745321303";"913 821 561";"";"csscarenal@madrid.es";"/contenido/entidadesYorganismos/CentrosAtencionSocialMayores/CentrosMayores"; 
180085;"Junta Municipal del Distrito de Ciudad Lineal";"Los Distritos obedecen a un proyecto de descentralización del Ayuntamiento de Madrid que tiene como objetivos acercar la prestación de los servicios municipales a la ciudadanía y promover la participación de la ciudadanía en la vida local. Los ciudadanos y ciudadanas pueden acudir a su Distrito a informarse y realizar gestiones tan diversas como reservas de matrimonios civiles, presentar reclamaciones de consumo, solicitar prestaciones de servicios sociales o realizar trámites relacionados con el  padrón municipal, licencias urbanísticas, vías y espacios públicos, entre otros. Además, los Distritos realizan actividades dirigidas a la promoción de la salud, la difusión de la cultura, la práctica del deporte, apoyo a la educación y en materia de inspección sanitaria y comercial.  Concejala Presidenta:  María Nadia Álvarez Padilla";"De lunes a viernes de 9 a 14 horas. Los horarios especiales se especifican en cada una de las dependencias.";"";"Metro: Ciudad Lineal (línea 5), Pueblo Nuevo (líneas 5, 7)  Bus: 38, 48, 70, 105, 4, 77, 109, 775";"Consulte la localización y el horario de la Oficina de Línea Madrid de Ciudad Lineal, donde se prestan principalmente y entre otros los servicios de registro, padrón e información.";"1";"http://www.madrid.es/sites/v/index.jsp?vgnextchannel=bfa48ab43d6bb410VgnVCM100000171f5a0aRCRD&vgnextoid=f5de0a47f441f010VgnVCM2000000c205a0aRCRD";"HERMANOS GARCIA NOBLEJAS";"CALLE";"V";"16";"";"";"";"";"MADRID";"MADRID";"28037";"2";"PUEBLO NUEVO";"15";"CIUDAD LINEAL";"445975";"4476345";"40.4359990280135";"-3.6369662067437245";"Consulte la pestaña &amp;quot;Más información&amp;quot;.";"";"";"/contenido/entidadesYorganismos/AyuntamientoMadrid/Distritos"; 
83922;"Museo de Arte Contemporáneo de Madrid";"Al igual que otros museos de arte contemporáneo, nacionales o extranjeros, se ha utilizado un edificio histórico para albergar las colecciones: el Cuartel del Conde Duque. El Museo de Arte Contemporáneo recupera para los madrileños el despacho del escritor vanguardista Ramón Gómez de la Serna, como parte de su colección permanente.";"De martes a viernes: de 10 a 14 horas y de 15 a 21 horas. Sábados: de 10 a 14 horas y de 17:30 a 21 horas. Domingos y festivos: de 10:30 a 14:30 horas.   Horario de verano: del 15 de junio al 15 de septiembre, ambos inclusive.  De martes a viernes: de 10 a 14 horas y de 15 a 20 horas. Sábados: de 10 a 14 horas y de 17:30 a 20 horas. Domingos y festivos: de 10:30 a 13:30 horas.   Cerrado: todos lunes y los días 1 y 6 de enero, 1 de mayo y 24, 25 y 31 de diciembre. Las salas se desalojan 15 minutos antes del cierre.";"Zona wifi.";"Metro: Ventura Rodríguez, Plaza de España, San Bernardo, Noviciado.  Bus: 1, 2, 21, 44, 74, 133, C, M2  Bicimad: Estación 13, Calle Conde Duque n&amp;ordm;22.  Parking:  Plaza de España";"";"1,6";"http://www.madrid.es/sites/v/index.jsp?vgnextchannel=bfa48ab43d6bb410VgnVCM100000171f5a0aRCRD&vgnextoid=84a55c2cdc41c010VgnVCM2000000c205a0aRCRD";"CONDE DUQUE";"CALLE";"V";"9";"";"";"";"";"MADRID";"MADRID";"28015";"";"CENTRO";"";"CENTRO";"439723";"4475437";"40.42737760210632";"-3.7106116887809817";"Teléfono de sala: 914 801 766";"";"mmacmdifusion@madrid.es";"/contenido/entidadesYorganismos/Museos"; 
2054;"Museo de Historia de Madrid";"Fue creado como museo municipal en 1929 y rebautizado como Museo de Historia de Madrid en 2007. En el año 2014 se hace una profunda remodelación y reabre sus puertas con un montaje moderno y una puesta al día de sus colecciones.";"De martes a domingos de 10 a 20 horas.  Verano: de martes a domingos de 10 a 19 horas.  Cerrado: lunes y los días 1 y 6 de enero, 1 de mayo,  24, 25 y 31 de diciembre.   El desalojo de las salas se hará diez minutos antes del cierre.";"Biblioteca de investigación Servicio de documentación Guardarropa Zona wifi";"Metro: Tribunal, Bilbao y Alonso Martínez. Bus: 3, 21, 37, 40, 147 y 149. BICIMAD: Estación 54 (Calle Barceló 7) Aparcamiento público: Barceló.";"Accesibilidad física:   Rampa de acceso a la entrada. Ascensores. Aseos adaptados. Silla de ruedas.";"1,6";"http://www.madrid.es/sites/v/index.jsp?vgnextchannel=bfa48ab43d6bb410VgnVCM100000171f5a0aRCRD&vgnextoid=8f3079262ef5d010VgnVCM1000000b205a0aRCRD";"FUENCARRAL";"CALLE";"V";"78";"";"";"";"";"MADRID";"MADRID";"28004";"4";"JUSTICIA";"1";"CENTRO";"440550";"4475251";"40.42577054821346";"-3.700845660719608";"917 011 863";"";"smuseosm@madrid.es";"/contenido/entidadesYorganismos/MonumentosEdificiosArtisticos"; 
2112;"Museo de San Isidro. Los Orígenes de Madrid";"Este espacio museográfico propone un viaje por la historia de la ciudad de Madrid desde la Prehistoria hasta el establecimiento de la Corte, a través de distintas salas como la de San Isidro, el Patio renacentista, el Jardín arqueobotánico o el Almacén visitable.";"De martes a domingo y festivos de 10 a 20 horas.  Último pase de visita 15 minutos antes del cierre.    Verano, del 15 de junio al 15 de septiembre: de martes a domingo de 10 a 19 horas.  Cerrado todos los lunes, el 1 y 6 de enero, el 1 de mayo y los días 24, 25 y 31 de diciembre.";"Sala de investigadores. Biblioteca especializada en arqueología e historia madrileña. Archivo documental. Almacén visitable con más de 600 piezas arqueológicas. Jardín arqueobotánico, con información documentada sobre las especies de la ciudad.  Investigadores: los fondos del Museo están a disposición de la comunidad científica y los investigadores podrán acceder tramitando su correspondiente solicitud. Visitas guiadas por voluntarios culturales de CEATE Talleres didácticos para grupos escolares. Zona wifi.";"Metro: Latina , Tirso de Molina Bus: 3 , 17 , 18 , 23 , 35 , 60 , 65 , 148 BICIMAD: Estación 38 (Carrera de San Francisco 1)";"";"2,6";"http://www.madrid.es/sites/v/index.jsp?vgnextchannel=bfa48ab43d6bb410VgnVCM100000171f5a0aRCRD&vgnextoid=7b7aef4d7f71c010VgnVCM1000000b205a0aRCRD";"SAN ANDRES";"PLAZA";"V";"2";"";"";"";"";"MADRID";"MADRID";"28005";"1";"PALACIO";"1";"CENTRO";"439691";"4473738";"40.41207900253883";"-3.7108161027466378";"913 667 415";"";"museosanisidro@madrid.es";"/contenido/entidadesYorganismos/Museos"; 
10189992;"Nave de Terneras del Centro Cultural Casa del Reloj";"";"Agosto cerrado.";"Wifi Aforo: 492 personas";"Metro: Legazpi (líneas 3, 6)  Bus: 62, 6, 78, 148  BICIMAD: Estación 165 (Paseo Chopera, 14)";"";"1";"http://www.madrid.es/sites/v/index.jsp?vgnextchannel=bfa48ab43d6bb410VgnVCM100000171f5a0aRCRD&vgnextoid=6c5c625c0d168510VgnVCM1000001d4a900aRCRD";"CHOPERA";"PASEO";"V";"10";"";"";"";"";"MADRID";"MADRID";"28045";"3";"CHOPERA";"2";"ARGANZUELA";"440713";"4471660";"40.393432756132874";"-3.6985778802913103";"915 886 299 / 915 886 118";"";"";"/contenido/entidadesYorganismos/CentrosCulturales"; 
24242;"Oficina Auxiliar de Atención a la Ciudadanía de El Pardo. Oficina de Atención a la Ciudadanía  (OAC). Línea Madrid Fuencarral - El Pardo";"Las Oficinas de Atención a la Ciudadanía de Línea Madrid son equipamientos del Ayuntamiento de Madrid en los que se puede solicitar información sobre la ciudad y realizar múltiples gestiones de forma cómoda y rápida. Cada Oficina de Atención a la Ciudadanía dispone a su vez de una oficina de registro para la que no necesita cita previa. En el apartado de 'información relacionada' se indican los documentos que no pueden presentarse por registro del Ayuntamiento de Madrid.  Para recibir atención en las oficinas, puede solicitar cita a través de los siguientes canales de Línea Madrid:   En Línea: accediendo al sistema municipal de cita previa y posteriormente seleccionando la gestión deseada.  Telefónico: a través del teléfono gratuito 010, si llama desde la ciudad de Madrid, o del 915 298 210, si llama desde la ciudad de Madrid o desde fuera (se factura como cualquier otra llamada al municipio de Madrid, en función de las tarifas que tenga contratado el abonado llamante). Ambos teléfonos están operativos las 24 horas del día, los 7 días de la semana, los 365 días del año.  Redes sociales:   Twitter @Lineamadrid.   Messenger de Facebook @Lineamadrid .    Chat en línea pulsando el icono &amp;ldquo;Chat on line Línea Madrid&amp;rdquo; que encontrará flotando en esta misma página.  Para hacer de las Oficinas de Atención a la Ciudadanía equipamientos cada vez más accesibles, en todas ellas se permite el acceso de perros guía acompañando a personas ciegas o con deficiencia visual grave (en otros casos la entrada con animales no está permitida). Además, esta oficina cuenta con las siguientes ayudas de accesibilidad para personas con dificultades especiales:";"Laborables de lunes a viernes de 8:30 a 14 horas. Cerrado el mes de agosto, los sábados y los días 24 y 31 de diciembre.   AVISO: Para el trámite de Registro el último tique se expedirá 15 minutos antes de la hora de cierre, a fin de poder atender a todas las personas en espera.  Atención en otros idiomas y lenguaje de signos ver apartado 'Servicios'.   Los sábados no hay abierto ningún registro.";"";"Bus: 601, 602";"";"1";"http://www.madrid.es/sites/v/index.jsp?vgnextchannel=bfa48ab43d6bb410VgnVCM100000171f5a0aRCRD&vgnextoid=73210a47f441f010VgnVCM2000000c205a0aRCRD";"EL PARDO";"PLAZA";"V";"2";"";"";"";"Acceso posterior, entrada desde la calle Mira el Río (accesible) o desde calle Carboneros (escaleras)";"MADRID";"MADRID";"28048";"1";"EL PARDO";"8";"FUENCARRAL-EL PARDO";"434150";"4485754";"40.51990216989406";"-3.777365185426138";"No se proporciona información telefónica. El teléfono de atención a la ciudadanía es el 010 (desde fuera del municipio de Madrid: 915 298 210)";"";"";"/contenido/entidadesYorganismos/AyuntamientoMadrid/OficinasMunicipalesRegistro"; 
24245;"Oficina Auxiliar de Atención a la Ciudadanía de Valverde. Oficina de Atención a la Ciudadanía  (OAC). Línea Madrid. Distrito de Fuencarral - El Pardo";"Las Oficinas de Atención a la Ciudadanía de Línea Madrid son equipamientos del Ayuntamiento de Madrid en los que se puede solicitar información sobre la ciudad y realizar múltiples gestiones de forma cómoda y rápida. Cada Oficina de Atención a la Ciudadanía dispone a su vez de una oficina de registro para la que no necesita cita previa. En el apartado de 'información relacionada' se indican los documentos que no pueden presentarse por registro del Ayuntamiento de Madrid.  Para recibir atención en las oficinas, puede solicitar cita a través de los siguientes canales de Línea Madrid:   En Línea: accediendo al sistema municipal de cita previa y posteriormente seleccionando la gestión deseada.  Telefónico: a través del teléfono gratuito 010, si llama desde la ciudad de Madrid, o del 915 298 210, si llama desde la ciudad de Madrid o desde fuera (se factura como cualquier otra llamada al municipio de Madrid, en función de las tarifas que tenga contratado el abonado llamante). Ambos teléfonos están operativos las 24 horas del día, los 7 días de la semana, los 365 días del año.  Redes sociales:   Twitter @Lineamadrid.   Messenger de Facebook @Lineamadrid .    Chat en línea pulsando el icono &amp;ldquo;Chat on line Línea Madrid&amp;rdquo; que encontrará flotando en esta misma página.  Para hacer de las Oficinas de Atención a la Ciudadanía equipamientos cada vez más accesibles, en todas ellas se permite el acceso de perros guía acompañando a personas ciegas o con deficiencia visual grave (en otros casos la entrada con animales no está permitida). Además, esta oficina cuenta con las siguientes ayudas de accesibilidad para personas con dificultades especiales:";"Laborables de lunes a viernes de 8:30 a 14 horas. Cerrado el mes de agosto, los sábados y los días 24 y 31 de diciembre.      AVISO: Para el trámite de Registro el último tique se expedirá 15 minutos antes de la hora de cierre, a fin de poder atender a todas las personas en espera.  Atención en otros idiomas y lenguaje de signos ver apartado 'Servicios'. Los sábados no hay abierto ningún registro.";"";"Bus: 66, 137";"";"1,4,6";"http://www.madrid.es/sites/v/index.jsp?vgnextchannel=bfa48ab43d6bb410VgnVCM100000171f5a0aRCRD&vgnextoid=76310a47f441f010VgnVCM2000000c205a0aRCRD";"ISLAS AZORES";"PLAZA";"V";"1";"";"";"";"";"MADRID";"MADRID";"28034";"6";"VALVERDE";"8";"FUENCARRAL-EL PARDO";"441701";"4482933";"40.49504578261263";"-3.687983425734921";"No se proporciona información telefónica. El teléfono de atención a la ciudadanía es el 010 (desde fuera del municipio de Madrid: 915 298 210)";"";"";"/contenido/entidadesYorganismos/AyuntamientoMadrid/OficinasMunicipalesRegistro"; 
5627235;"Oficina de Asistencia en Materia de Registro. Agencia de Actividades";"La entrada con animales no está permitida, excepto en el caso de perros guía acompañantes de personas ciegas o con deficiencia visual grave.";"Laborables, de lunes a viernes de 8:30 a 14 horas. Cerrado los sábados y los días 24 y 31 de diciembre. Los sábados no hay abierto ningún registro.";"Las Oficinas de Registro del Ayuntamiento de Madrid están facultadas para recoger escritos dirigidos a cualquier órgano administrativo, ya sea de la Administración General del Estado, de la Administración Autonómica o de la Administración Local. En información relacionada se indican los documentos que no pueden presentarse por registro del Ayuntamiento de Madrid.";"Metro: Delicias (línea 3), Palos de la Frontera (línea 3).  Bus: 6, 8, 19, 45, 47, 55, 59, 85, 86, 102.  Renfe: Delicias, Atocha.";"Zona wifi de libre acceso";"0";"http://www.madrid.es/sites/v/index.jsp?vgnextchannel=bfa48ab43d6bb410VgnVCM100000171f5a0aRCRD&vgnextoid=f7c6f4061d497210VgnVCM2000000c205a0aRCRD";"BUSTAMANTE";"CALLE";"V";"16";"";"";"";"";"MADRID";"MADRID";"28045";"5";"DELICIAS";"2";"ARGANZUELA";"441594";"4472433";"40.400449587879166";"-3.6882686006118175";"010 (desde fuera del municipio de Madrid: 915 298 210)";"";"";"/contenido/entidadesYorganismos/AyuntamientoMadrid/OficinasMunicipalesRegistro"; 
180717;"Oficina de Atención a la Ciudadanía. (OAC) Línea Madrid. Distrito de Arganzuela";"Las Oficinas de Atención a la Ciudadanía de Línea Madrid son equipamientos del Ayuntamiento de Madrid en los que se puede solicitar información sobre la ciudad y realizar múltiples gestiones  de forma cómoda y rápida.  Cada Oficina de Atención a la Ciudadanía dispone a su vez de una oficina de registro para la que no necesita cita previa. En el apartado de 'información relacionada' se indican los documentos que no pueden presentarse por registro del Ayuntamiento de Madrid.  Para recibir atención en las oficinas, puede solicitar cita a través de los siguientes canales de Línea Madrid:   En Línea: accediendo al sistema de cita previa y posteriormente seleccionando la gestión deseada.  Telefónico: a través del teléfono gratuito 010, si llama desde la ciudad de Madrid, o del 915 298 210, si llama desde la ciudad de Madrid o desde fuera (se factura como cualquier otra llamada al municipio de Madrid, en función de las tarifas que tenga contratado el abonado llamante). Ambos teléfonos están operativos las 24 horas del día, los 7 días de la semana, los 365 días del año.  Redes sociales:   Twitter @Lineamadrid.   Messenger de Facebook @Lineamadrid .    Chat en línea pulsando el icono &amp;ldquo;Chat on line Línea Madrid&amp;rdquo; que encontrará flotando en esta misma página.  Para hacer de las Oficinas de Atención a la Ciudadanía equipamientos cada vez más accesibles, en todas ellas se permite el acceso de perros guía acompañando a personas ciegas o con deficiencia visual grave (en otros casos la entrada con animales no está permitida). Además, esta oficina cuenta con las siguientes ayudas de accesibilidad para personas con dificultades especiales:";"Días laborables:  Lunes a jueves, de 8:30 a 17 horas. Viernes de 8:30 a 14 horas.   Julio y agosto: lunes a viernes de 8:30 a 14 horas.  Avisos: Cerrada los sábados y los días 24 y 31 de diciembre. Los sábados no hay ningún registro abierto. Para el trámite de Registro el último tique se expedirá 15 minutos antes de la hora de cierre, a fin de poder atender a todas las personas en espera. Atención en otros idiomas y lenguaje de signos ver apartado Servicios.";"Atención en otros idiomas:    Lengua de signos española e inglés: 8:30 a 17 horas.      Zona wifi.";"Metro: Legazpi (líneas 3, 6)  Bus: 6, 18, 78, 148, 62  Bicimad: Estación 165 (Paseo de la Chopera, 14)";"Consulte las oficinas de Línea Madrid";"1,4,6";"http://www.madrid.es/sites/v/index.jsp?vgnextchannel=bfa48ab43d6bb410VgnVCM100000171f5a0aRCRD&vgnextoid=67da8aa6bd91f010VgnVCM1000000b205a0aRCRD";"CHOPERA";"PASEO";"V";"10";"";"";"";"";"MADRID";"MADRID";"28045";"3";"CHOPERA";"2";"ARGANZUELA";"440714";"4471656";"40.3933877847248";"-3.698565632659468";"No se proporciona información telefónica. El teléfono de atención a la ciudadanía es el 010 (desde fuera del municipio de Madrid: 915 298 210)";"";"";"/contenido/entidadesYorganismos/AyuntamientoMadrid/OficinasMunicipalesRegistro"; 
